{
  "schema_version": 1,
  "source": {
    "source_type": "text",
    "source_ref": "evals/samples/clear-print-physics",
    "page_count": 1
  },
  "questions": [
    {
      "source_locator": "page-1-question-1",
      "subject": {
        "value": "物理",
        "confidence": 0.99
      },
      "question_text": "一个物体质量为 2 kg，受到 10 N 的水平拉力，求加速度。（不计摩擦）",
      "student_answer": "0.2 m/s²",
      "correct_answer": "5 m/s²",
      "is_wrong": true,
      "knowledge_candidates": [
        {
          "label": "牛顿第二定律",
          "confidence": 0.96
        }
      ],
      "error_reason_candidates": [],
      "extraction_confidence": 0.96,
      "needs_confirmation": false,
      "uncertain_fields": []
    },
    {
      "source_locator": "page-1-question-2",
      "subject": {
        "value": "物理",
        "confidence": 0.99
      },
      "question_text": "家庭电路的电压是 ___ V。",
      "student_answer": "220",
      "correct_answer": "220",
      "is_wrong": false,
      "knowledge_candidates": [
        {
          "label": "家庭电路",
          "confidence": 0.98
        }
      ],
      "error_reason_candidates": [],
      "extraction_confidence": 0.98,
      "needs_confirmation": false,
      "uncertain_fields": []
    },
    {
      "source_locator": "page-1-question-3",
      "subject": {
        "value": "物理",
        "confidence": 0.98
      },
      "question_text": "下列哪种现象说明分子在不停地做无规则运动？A. 柳絮飞扬 B. 花香四溢 C. 雪花飘飘",
      "student_answer": "A",
      "correct_answer": "B",
      "is_wrong": true,
      "knowledge_candidates": [
        {
          "label": "分子热运动",
          "confidence": 0.95
        }
      ],
      "error_reason_candidates": [],
      "extraction_confidence": 0.95,
      "needs_confirmation": false,
      "uncertain_fields": []
    }
  ],
  "warnings": []
}
