{
  "schema_version": 1,
  "source": {
    "source_type": "text",
    "source_ref": "evals/samples/blurry-rotated-math",
    "page_count": 1
  },
  "questions": [
    {
      "source_locator": "page-1-question-1",
      "subject": {
        "value": "数学",
        "confidence": 0.53
      },
      "question_text": "计算：3.6 ÷ 0.4 = ?",
      "student_answer": "9",
      "correct_answer": "9",
      "is_wrong": false,
      "knowledge_candidates": [
        {
          "label": "小数除法",
          "confidence": 0.5
        }
      ],
      "error_reason_candidates": [],
      "extraction_confidence": 0.5,
      "needs_confirmation": true,
      "uncertain_fields": [
        "student_answer"
      ]
    },
    {
      "source_locator": "page-1-question-2",
      "subject": {
        "value": "数学",
        "confidence": 0.33
      },
      "question_text": "一个长方形的长是 9 cm，宽是 4 cm",
      "student_answer": null,
      "correct_answer": "26 cm",
      "is_wrong": true,
      "knowledge_candidates": [
        {
          "label": "长方形周长",
          "confidence": 0.3
        }
      ],
      "error_reason_candidates": [],
      "extraction_confidence": 0.3,
      "needs_confirmation": true,
      "uncertain_fields": [
        "question_text",
        "student_answer"
      ]
    }
  ],
  "warnings": [
    "页面旋转且有墨迹遮挡：第 2 题题干残缺、学生答案无法辨认，未强行编造。"
  ]
}
