{
  "schema_version": 1,
  "source": {
    "source_type": "text",
    "source_ref": "evals/samples/no-answer-math",
    "page_count": 1
  },
  "questions": [
    {
      "source_locator": "page-1-question-1",
      "subject": {
        "value": "数学",
        "confidence": 0.93
      },
      "question_text": "计算：(1/2 - 1/3) × 6 = ?",
      "student_answer": "5",
      "correct_answer": null,
      "is_wrong": true,
      "knowledge_candidates": [
        {
          "label": "分数混合运算",
          "confidence": 0.9
        }
      ],
      "error_reason_candidates": [],
      "extraction_confidence": 0.9,
      "needs_confirmation": false,
      "uncertain_fields": []
    },
    {
      "source_locator": "page-1-question-2",
      "subject": {
        "value": "数学",
        "confidence": 0.93
      },
      "question_text": "某数的 3 倍比它的 2 倍大 6，求这个数。",
      "student_answer": "3",
      "correct_answer": null,
      "is_wrong": true,
      "knowledge_candidates": [
        {
          "label": "列方程解题",
          "confidence": 0.9
        }
      ],
      "error_reason_candidates": [],
      "extraction_confidence": 0.9,
      "needs_confirmation": false,
      "uncertain_fields": []
    }
  ],
  "warnings": [
    "附件未包含标准答案，correct_answer 留空。"
  ]
}
