{
  "schema_version": 1,
  "source": {"source_type": "text", "source_ref": "evals/samples/sample-01-clear-print-math", "page_count": 1},
  "questions": [
    {
      "source_locator": "page-1-question-1",
      "subject": {"value": "数学", "confidence": 0.99},
      "question_text": "计算：3/4 + 1/6 = ?",
      "student_answer": "4/10",
      "correct_answer": "11/12",
      "is_wrong": true,
      "knowledge_candidates": [{"label": "异分母分数加法", "confidence": 0.95}],
      "error_reason_candidates": [{"code": "procedure_gap", "confidence": 0.8}],
      "extraction_confidence": 0.96,
      "needs_confirmation": false,
      "uncertain_fields": []
    },
    {
      "source_locator": "page-1-question-2",
      "subject": {"value": "数学", "confidence": 0.98},
      "question_text": "一桶油重 3/4 千克，用去 1/3 后还剩多少千克？",
      "student_answer": "1/2",
      "correct_answer": "1/2 千克",
      "is_wrong": false,
      "knowledge_candidates": [{"label": "分数应用题", "confidence": 0.9}],
      "error_reason_candidates": [],
      "extraction_confidence": 0.93,
      "needs_confirmation": false,
      "uncertain_fields": []
    }
  ],
  "warnings": []
}
