{
  "schema_version": 1,
  "source": {
    "source_type": "text",
    "source_ref": "evals/samples/clear-print-math",
    "page_count": 1
  },
  "questions": [
    {
      "source_locator": "page-1-question-1",
      "subject": {
        "value": "数学",
        "confidence": 0.99
      },
      "question_text": "解方程：3(x - 2) = 2x + 1",
      "student_answer": "x = 5",
      "correct_answer": "x = 7",
      "is_wrong": true,
      "knowledge_candidates": [
        {
          "label": "一元一次方程",
          "confidence": 0.97
        }
      ],
      "error_reason_candidates": [],
      "extraction_confidence": 0.97,
      "needs_confirmation": false,
      "uncertain_fields": []
    },
    {
      "source_locator": "page-1-question-2",
      "subject": {
        "value": "数学",
        "confidence": 0.99
      },
      "question_text": "计算：125 × 32 × 25 = ?",
      "student_answer": "100000",
      "correct_answer": "100000",
      "is_wrong": false,
      "knowledge_candidates": [
        {
          "label": "乘法结合律与简算",
          "confidence": 0.98
        }
      ],
      "error_reason_candidates": [],
      "extraction_confidence": 0.98,
      "needs_confirmation": false,
      "uncertain_fields": []
    },
    {
      "source_locator": "page-1-question-3",
      "subject": {
        "value": "数学",
        "confidence": 0.99
      },
      "question_text": "一个圆的半径是 4 cm，求它的面积。（π 取 3.14）",
      "student_answer": "25.12 cm²",
      "correct_answer": "50.24 cm²",
      "is_wrong": true,
      "knowledge_candidates": [
        {
          "label": "圆的面积",
          "confidence": 0.96
        }
      ],
      "error_reason_candidates": [],
      "extraction_confidence": 0.96,
      "needs_confirmation": false,
      "uncertain_fields": []
    }
  ],
  "warnings": []
}
