{
  "schema_version": 1,
  "source": {
    "source_type": "text",
    "source_ref": "evals/samples/multipage-chinese-english",
    "page_count": 3
  },
  "questions": [
    {
      "source_locator": "page-1-question-1",
      "subject": {
        "value": "语文",
        "confidence": 0.97
      },
      "question_text": "下列句子使用了拟人修辞手法的一项是（ ）A. 月亮像玉盘。B. 花儿在风中笑。",
      "student_answer": "A",
      "correct_answer": "B",
      "is_wrong": true,
      "knowledge_candidates": [
        {
          "label": "修辞手法",
          "confidence": 0.94
        }
      ],
      "error_reason_candidates": [],
      "extraction_confidence": 0.94,
      "needs_confirmation": false,
      "uncertain_fields": []
    },
    {
      "source_locator": "page-2-question-2",
      "subject": {
        "value": "语文",
        "confidence": 0.96
      },
      "question_text": "给下列加点字注音：炽热",
      "student_answer": "zhì rè",
      "correct_answer": "chì rè",
      "is_wrong": true,
      "knowledge_candidates": [
        {
          "label": "字音",
          "confidence": 0.93
        }
      ],
      "error_reason_candidates": [],
      "extraction_confidence": 0.93,
      "needs_confirmation": false,
      "uncertain_fields": []
    },
    {
      "source_locator": "page-3-question-3",
      "subject": {
        "value": "英语",
        "confidence": 0.98
      },
      "question_text": "翻译：图书馆在邮局旁边。",
      "student_answer": "The library is next to the post office.",
      "correct_answer": "The library is next to the post office.",
      "is_wrong": false,
      "knowledge_candidates": [
        {
          "label": "汉译英",
          "confidence": 0.95
        }
      ],
      "error_reason_candidates": [],
      "extraction_confidence": 0.95,
      "needs_confirmation": false,
      "uncertain_fields": []
    },
    {
      "source_locator": "page-3-question-4",
      "subject": {
        "value": "英语",
        "confidence": 0.97
      },
      "question_text": "选择：—How ___ is the T-shirt? —It's 50 yuan. A. many B. much C. old",
      "student_answer": "A",
      "correct_answer": "B",
      "is_wrong": true,
      "knowledge_candidates": [
        {
          "label": "疑问词",
          "confidence": 0.94
        }
      ],
      "error_reason_candidates": [],
      "extraction_confidence": 0.94,
      "needs_confirmation": false,
      "uncertain_fields": []
    }
  ],
  "warnings": []
}
