{
  "schema_version": 1,
  "source": {
    "source_type": "text",
    "source_ref": "evals/samples/clear-print-chinese",
    "page_count": 1
  },
  "questions": [
    {
      "source_locator": "page-1-question-1",
      "subject": {
        "value": "语文",
        "confidence": 0.99
      },
      "question_text": "下列词语中没有错别字的一项是（ ）A. 再接再励 B. 一如既往 C. 穿流不息 D. 黄梁美梦",
      "student_answer": "A",
      "correct_answer": "B",
      "is_wrong": true,
      "knowledge_candidates": [
        {
          "label": "错别字辨析",
          "confidence": 0.97
        }
      ],
      "error_reason_candidates": [],
      "extraction_confidence": 0.97,
      "needs_confirmation": false,
      "uncertain_fields": []
    },
    {
      "source_locator": "page-1-question-2",
      "subject": {
        "value": "语文",
        "confidence": 0.99
      },
      "question_text": "默写：海内存知己，________。",
      "student_answer": "天涯若比邻",
      "correct_answer": "天涯若比邻",
      "is_wrong": false,
      "knowledge_candidates": [
        {
          "label": "古诗文默写",
          "confidence": 0.98
        }
      ],
      "error_reason_candidates": [],
      "extraction_confidence": 0.98,
      "needs_confirmation": false,
      "uncertain_fields": []
    },
    {
      "source_locator": "page-1-question-3",
      "subject": {
        "value": "语文",
        "confidence": 0.98
      },
      "question_text": "修改病句：通过这次活动，使我明白了团结的重要性。",
      "student_answer": "在句末加上“的精神”",
      "correct_answer": "删去“通过”或“使”",
      "is_wrong": true,
      "knowledge_candidates": [
        {
          "label": "病句修改",
          "confidence": 0.95
        }
      ],
      "error_reason_candidates": [],
      "extraction_confidence": 0.95,
      "needs_confirmation": false,
      "uncertain_fields": []
    }
  ],
  "warnings": []
}
